{"adapter":"huggingface-trainer","assumptions":["CPU-only included local Trainer workload","Sequential deterministic synthetic dataset","Transformers and Accelerate versions recorded in environment evidence"],"framework":"transformers","items":[{"evidence_ids":["trainer_state.json"],"exactness":"exact","identity_controls":[],"reason":"Resume the exact next batch.","recovery_source":"checkpoint","requirement":"required","state_id":"batch_position"},{"evidence_ids":["trainer_state.json"],"exactness":"exact","identity_controls":[],"reason":"Preserve completed progress.","recovery_source":"checkpoint","requirement":"required","state_id":"global_step"},{"evidence_ids":["model.safetensors"],"exactness":"exact","identity_controls":[],"reason":"Restore all trained parameters.","recovery_source":"checkpoint","requirement":"required","state_id":"model"},{"evidence_ids":["rng_state.pth"],"exactness":"exact","identity_controls":[],"reason":"Restore NumPy stochastic state.","recovery_source":"checkpoint","requirement":"required","state_id":"numpy_rng"},{"evidence_ids":["optimizer.pt"],"exactness":"exact","identity_controls":[],"reason":"Preserve optimizer trajectory state.","recovery_source":"checkpoint","requirement":"required","state_id":"optimizer"},{"evidence_ids":["rng_state.pth"],"exactness":"exact","identity_controls":[],"reason":"Restore Python stochastic state.","recovery_source":"checkpoint","requirement":"required","state_id":"python_rng"},{"evidence_ids":["scheduler.pt"],"exactness":"exact","identity_controls":[],"reason":"Preserve the learning-rate phase.","recovery_source":"checkpoint","requirement":"required","state_id":"scheduler"},{"evidence_ids":["rng_state.pth"],"exactness":"exact","identity_controls":[],"reason":"Restore dropout stochastic state.","recovery_source":"checkpoint","requirement":"required","state_id":"torch_rng"},{"evidence_ids":["trainer_state.json"],"exactness":"exact","identity_controls":[],"reason":"Restore Trainer progress and log history.","recovery_source":"checkpoint","requirement":"required","state_id":"trainer_state"}],"max_rpo_steps":0,"qualification_profile":"exact-training-resume","schema_version":"flashpilot-persistence-contract-v1","warnings":["Only the deterministic exact-trajectory gate can verify recovery.","This contract does not claim compatibility with arbitrary Trainer scripts."]}
