{"adapter":"native-pytorch","assumptions":["CPU-only controlled workload","Only residual-adapter parameters are trainable"],"framework":"native-pytorch","items":[{"evidence_ids":["restore:model-state"],"exactness":"exact","identity_controls":["manifest-entry","sha256-checksum"],"reason":"The trainable residual adapter must restore exactly.","recovery_source":"checkpoint","requirement":"required","state_id":"adapter"},{"evidence_ids":["base:presence","base:sha256"],"exactness":"exact","identity_controls":["base-artifact-identity","base-artifact-sha256"],"reason":"The adapter must bind to the exact immutable frozen base.","recovery_source":"immutable_reference","requirement":"required","state_id":"base_model_identity"},{"evidence_ids":["process:next-step"],"exactness":"exact","identity_controls":["global-seed","global-step"],"reason":"The controlled workload derives the next batch from seed and global step.","recovery_source":"deterministic_recompute","requirement":"required","state_id":"batch_position"},{"evidence_ids":["manifest:global-step"],"exactness":"exact","identity_controls":["manifest-entry","sha256-checksum"],"reason":"The exact completed-step position must restore.","recovery_source":"checkpoint","requirement":"required","state_id":"global_step"},{"evidence_ids":["restore:numpy-rng"],"exactness":"exact","identity_controls":["manifest-entry","sha256-checksum"],"reason":"NumPy RNG progression must restore exactly.","recovery_source":"checkpoint","requirement":"required","state_id":"numpy_rng"},{"evidence_ids":["restore:optimizer-state"],"exactness":"exact","identity_controls":["manifest-entry","sha256-checksum"],"reason":"AdamW continuation state must restore exactly.","recovery_source":"checkpoint","requirement":"required","state_id":"optimizer"},{"evidence_ids":["restore:python-rng"],"exactness":"exact","identity_controls":["manifest-entry","sha256-checksum"],"reason":"Python RNG progression must restore exactly.","recovery_source":"checkpoint","requirement":"required","state_id":"python_rng"},{"evidence_ids":["restore:scheduler-state"],"exactness":"exact","identity_controls":["manifest-entry","sha256-checksum"],"reason":"LinearLR continuation state must restore exactly.","recovery_source":"checkpoint","requirement":"required","state_id":"scheduler"},{"evidence_ids":["restore:torch-rng"],"exactness":"exact","identity_controls":["manifest-entry","sha256-checksum"],"reason":"Torch RNG progression, including dropout, must restore exactly.","recovery_source":"checkpoint","requirement":"required","state_id":"torch_rng"}],"max_rpo_steps":0,"qualification_profile":"exact-training-resume","schema_version":"flashpilot-persistence-contract-v1","warnings":["Only the deterministic Recovery Gate can verify recovery."]}
